[
  {
    "schemaVersion": 1,
    "variantId": "quiet_mist",
    "template": "Aura",
    "color": [
      0.3,
      0.65,
      0.72,
      0.55
    ],
    "intensity": 1,
    "scale": 1,
    "durationSeconds": 8,
    "theme": "mist",
    "socket": "aura_root",
    "realmPresentationLevel": 0
  },
  {
    "schemaVersion": 1,
    "variantId": "leaf_current",
    "template": "Aura",
    "color": [
      0.45,
      0.65,
      0.3,
      0.6
    ],
    "intensity": 1,
    "scale": 1,
    "durationSeconds": 8,
    "theme": "leaves",
    "socket": "aura_root",
    "realmPresentationLevel": 0
  },
  {
    "schemaVersion": 1,
    "variantId": "ember_warning",
    "template": "Aura",
    "color": [
      0.85,
      0.4,
      0.2,
      0.55
    ],
    "intensity": 1,
    "scale": 1,
    "durationSeconds": 8,
    "theme": "warning",
    "socket": "aura_root",
    "realmPresentationLevel": 0
  }
]